{
  "schema": "steamcloud.operation-definition/v1",
  "operation": "steam.catalog.observe",
  "version": 1,
  "risk_class": "R0",
  "policy_status": "PRIVATE_CANARY",
  "account_classes": [
    "PLATFORM_CATALOG_COLLECTOR",
    "TEST_CANARY"
  ],
  "action_kind": "asf.steam.catalog.fetch",
  "credential_kind": null,
  "egress_role": "catalog-pics",
  "retry_class": "SAFE",
  "maximum_runtime_seconds": 120,
  "result_schema": "steamcloud.source-artifact/v1",
  "requires_human_approval": false
}
