{
  "schema": "steamcloud.operation-definition/v1",
  "operation": "steam.profile.public.refresh",
  "version": 1,
  "risk_class": "R0",
  "policy_status": "ENABLED",
  "account_classes": [
    "PLATFORM_PUBLIC_BOT"
  ],
  "action_kind": "asf.steam.webapi.fetch",
  "credential_kind": "platform_webapi_key",
  "egress_role": "webapi-public",
  "retry_class": "SAFE",
  "maximum_runtime_seconds": 30,
  "result_schema": "steamcloud.source-artifact/v1",
  "requires_human_approval": false
}
