{
  "schema": "steamcloud.operation-definition/v1",
  "operation": "steam.account.session_status",
  "version": 1,
  "risk_class": "R1",
  "policy_status": "ENABLED",
  "account_classes": [
    "CUSTOMER_LINKED",
    "PLATFORM_PUBLIC_BOT",
    "TEST_CANARY"
  ],
  "action_kind": "asf.account.session_status",
  "credential_kind": null,
  "egress_role": null,
  "retry_class": "SAFE",
  "maximum_runtime_seconds": 10,
  "result_schema": "steamcloud.world-view/v1",
  "requires_human_approval": false
}
