{
  "schema": "steamcloud.operation-definition/v1",
  "operation": "steam.profile.owner.refresh",
  "version": 1,
  "risk_class": "R1",
  "policy_status": "USER_ACTION_REQUIRED",
  "account_classes": [
    "EPHEMERAL_OWNER"
  ],
  "action_kind": "asf.owner.edge.fetch",
  "credential_kind": null,
  "egress_role": null,
  "retry_class": "SAFE",
  "maximum_runtime_seconds": 60,
  "result_schema": "steamcloud.source-artifact/v1",
  "requires_human_approval": true
}
